{"actions":[{"ref":"steam:400","type":"launch"},{"type":"launch","args":"--start-minimized","path":"{tools}\\Chat\\chat.exe","skipIfRunning":true},{"ms":2000,"type":"wait"},{"url":"https://example.com/stream","type":"url"},{"path":"%USERPROFILE%\\Videos","type":"folder"},{"label":"Close the launcher","force":true,"graceMs":3000,"processes":["samplelauncher.exe"],"type":"close"}],"variables":{"tools":"%LOCALAPPDATA%\\SampleTools"},"pinned":true,"description":"Open the game, chat and the stream page; close the launcher.","name":{"es":"Noche de juegos","en":"Game night"},"id":"game-night","schema":1}
